number,question
Q10.1,"In a marine ecosystem with declining populations of both commercial and non-commercial fish species, which combination of fishing gear modifications would likely be most effective in promoting sustainable fishing practices?"
Q11.1,Which of the following outcomes is most likely to result from fitting a sievenet to shrimp/prawn trawl nets?
Q12.1,Which of the following outcomes is most likely when using a moving trailer suction hopper dredger for aggregate extraction compared to a static suction hopper dredger?
Q13.1,Which of the following outcomes is most likely to occur within one year of planting Sphagnum-dominated sods in a rewetted bog?
Q14.1,"A salmon farm manager wants to implement the most effective strategy to control sea lice infestations. Based on the provided information, which of the following approaches should they prioritize?"
Q15.1,A tomato farmer wants to implement an integrated pest management approach that minimizes unnecessary insecticide use. Which of the following strategies would be most aligned with the conservation action described?
Q16.1,How does the age of restored riparian plots generally affect bird populations?
Q17.1,How might retaining crop residues impact water management in agricultural systems?
Q18.1,How might the effectiveness of primate habituation to human presence vary across different geographical regions and species?
Q19.1,"In the context of brackish/saline wetland restoration, what is the most likely outcome of applying a non-fungal root dip to smooth cordgrass (Spartina alterniflora) before planting?"
Q20.1,"In the context of butterfly conservation on transmission lines, what is the relationship between herbicide spraying, mowing, and northern pearl crescent abundance?"
Q21.1,"In the context of enhancing wild bee populations in agricultural landscapes, what potential limitation should be considered when implementing flower planting strategies?"
Q22.1,"In the context of group-selection harvesting, which of the following statements best reflects the complexity of its ecological impacts?"
Q23.1,What factors can increase the efficiency of chemical treatments in controlling Asian clam populations?
Q24.1,What is a potential challenge when implementing water source diversion as a conservation action in peatlands?
Q25.1,What is a potential trade-off to consider when modifying longline configuration from wire to nylon hook attachments?
Q26.1,What is the most likely effect of adding carbon to soil after sowing seeds on the density of sown forb species in grassland restoration projects?
Q27.1,What is the most likely long-term impact of implementing wild bird cover on farmland plant communities?
Q28.1,Which of the following approaches is most likely to enhance the effectiveness of an electrical barrier in preventing the migration of invasive round gobies?
Q29.1,Which of the following bait types would likely be most effective in reducing unwanted turtle catch in fishing nets?
Q30.1,Which of the following best describes the effectiveness of cleaner wrasse as a natural control agent for sea lice in salmon aquaculture?
Q31.1,Which of the following best describes the overall effectiveness of legal protection for primate species under threat?
Q32.1,Which of the following factors is most likely to enhance the effectiveness of conservation headlands for plant diversity?
Q33.1,Which of the following is most likely to be a direct result of reducing livestock grazing intensity in forests?
Q34.1,Which of the following is the most likely long-term ecological benefit of planting riparian buffer strips for reptile conservation?
Q35.1,Which of the following modifications to outdoor lighting is most likely to reduce its impact on nocturnal insects?
Q36.1,Which of the following outcomes is LEAST likely to result from implementing integrated aquaculture systems with fish farms?
Q37.1,Which of the following outcomes is most likely to occur after diverting or replacing polluted water sources in peatlands?
Q38.1,Which of the following outcomes is most likely to occur as a result of rescuing and releasing stranded marine mammals?
Q39.1,Which of the following outcomes is most likely to occur when reducing or stopping grazing in shrubland ecosystems?
Q4.1,Which of the following strategies is most likely to be effective in conserving Agassiz's desert tortoise populations?
Q40.1,Which of the following outcomes is most likely to result from combining increased livestock grazing with prescribed burning in shrubland ecosystems?
Q41.1,Which of the following outcomes is most likely to result from creating groove habitats on subtidal artificial structures?
Q42.1,Which of the following outcomes is most likely to result from presenting food in water for captive primates?
Q43.1,Which of the following outcomes is most likely when implementing reduced tillage in arable fields for pest regulation?
Q44.1,Which of the following statements best reflects the current understanding of traditional orchard maintenance as a conservation strategy for birds?
Q45.1,Which of the following strategies is most likely to enhance the reproductive success of native bee species in agricultural landscapes?
Q46.1,Which of the following strategies would be most effective for increasing bat activity in logged areas?
Q47.1,What conclusion can be drawn about the behavioral response of various mammal species to ultrasonic warning devices mounted on vehicles?
Q48.1,"In the context of human-wildlife conflict mitigation, which of the following strategies would likely be most effective in protecting livestock?"
Q49.1,What is a potential outcome of restoring habitat connectivity between wetlands separated by a road?
Q5.1,Which of the following outcomes is most likely to occur when small swimthrough habitats are created on intertidal artificial structures?
Q50.1,Which of the following statements best describes the impact of leave-tree harvesting on salamander populations compared to clearcutting?
Q6.1,Which of the following outcomes is most likely to result from creating natural rocky reef topography on intertidal artificial structures?
Q7.1,Which of the following outcomes is most likely to result from sowing grassland seeds from a local source compared to using a commercial seed mix?
Q8.1,A conservation manager aims to increase bee species richness in an area with power line infrastructure. Which of the following strategies should they prioritize?
Q9.1,Which of the following outcomes is most likely when raising water levels to restore brackish/salt marshes from other land uses?
